{"$schema":"https://json-schema.org/draft/2020-12/schema","type":"object","additionalProperties":false,"required":["schema_version","tested_processing_window_count","tested_processing_window_ids","mean_loco_ranking_across_tested_windows","mean_loco_winner_across_tested_windows","W_H2_first_in_every_tested_window","adoption_decision_across_tested_windows","all_tested_windows_reject_evolving_model_adoption","effect_magnitude_across_tested_windows","condition_sign_pattern_across_tested_windows","parameter_stability","coverage_stability","broader_processing_robustness","processing_disposition"],"properties":{"schema_version":{"const":2},"tested_processing_window_count":{"const":5},"tested_processing_window_ids":{"type":"array","minItems":5,"maxItems":5,"uniqueItems":true,"items":{"type":"string"}},"mean_loco_ranking_across_tested_windows":{"const":"STABLE"},"mean_loco_winner_across_tested_windows":{"const":"W-H2"},"W_H2_first_in_every_tested_window":{"const":true},"adoption_decision_across_tested_windows":{"const":"STABLE_NO_EVOLVING_MODEL_PASSES"},"all_tested_windows_reject_evolving_model_adoption":{"const":true},"effect_magnitude_across_tested_windows":{"const":"VARIABLE"},"condition_sign_pattern_across_tested_windows":{"const":"VARIABLE"},"parameter_stability":{"const":"VARIABLE"},"coverage_stability":{"const":"STABLE"},"broader_processing_robustness":{"const":"NOT_ESTABLISHED_BEYOND_TESTED_CONFIGURATIONS"},"processing_disposition":{"const":"ADOPTION_DECISION_ROBUST_WITHIN_TESTED_PROCESSING_WINDOWS"}}}
